{
  "id": "opensuse-tumbleweed",
  "name": "openSUSE Tumbleweed",
  "description": "Rolling release distribution with latest software, Btrfs snapshots, YaST control panel, and enterprise-grade stability from SUSE.",
  "homepage": "https://get.opensuse.org/tumbleweed",
  "logo_url": "https://upload.wikimedia.org/wikipedia/commons/d/d0/OpenSUSE_Logo.svg",
  "category": "Desktop",
  "family": "independent",
  "base_distro": "opensuse",
  "secure_boot_compatible": true,
  "popularity_rank": 14,
  "releases": [
    {
      "version": "20260129",
      "release_date": "2026-01-29",
      "iso_url": "https://download.opensuse.org/tumbleweed/iso/openSUSE-Tumbleweed-DVD-x86_64-Current.iso",
      "sha256": "1650d689a248befed4bf618fcba76c9a404bfdab560f7cee3f18dc4c5033618b",
      "size_mb": 4300,
      "architecture": "x86_64",
      "mirrors": [
        "https://ftp.halifax.rwth-aachen.de/opensuse/tumbleweed/iso/openSUSE-Tumbleweed-DVD-x86_64-Current.iso",
        "https://mirror.yandex.ru/opensuse/tumbleweed/iso/openSUSE-Tumbleweed-DVD-x86_64-Current.iso",
        "https://mirror.math.princeton.edu/pub/opensuse/tumbleweed/iso/openSUSE-Tumbleweed-DVD-x86_64-Current.iso"
      ],
      "gpg_verified": false
    }
  ],
  "metadata": {
    "last_updated": "2026-01-29T08:56:29Z",
    "maintainer": "LUXusb Team",
    "verified": true,
    "note": "Tumbleweed is rolling release. Download .sha256 file from same directory and verify with GPG (opensuse@opensuse.org)."
  }
}